{
 "fixture_id": "tst050-p19",
 "persona": "TST-050-P19: 12 h/week sub-elite marathoner",
 "sources": [
  "14 §5",
  "TST-050-P19"
 ],
 "release": "R2",
 "input": {
  "schema_version": "v5.2",
  "today": "2026-11-02",
  "timezone": "Europe/Paris",
  "ruleset_version": "v5.2",
  "registry_version": "v5.2",
  "declared_unknown": [],
  "profile": {
   "id": "runner",
   "birth_month": 6,
   "birth_year": 1991,
   "sex": null,
   "training_age_years": 12,
   "never_run": false,
   "other_sport_background": "none",
   "injury_last_12m": false,
   "available_days": [
    "Mon",
    "Tue",
    "Wed",
    "Thu",
    "Fri",
    "Sat",
    "Sun"
   ],
   "max_runs_per_week": 7,
   "available_minutes_per_week": 720,
   "blocked_dates": [],
   "long_run_day": "Sun",
   "run_walk_preference": false,
   "run_walk_preference_explicit": false,
   "preset_preference": null,
   "night_shift_dates": [],
   "hill_access": false,
   "nutrition_referral_flag": false,
   "caffeine_sensitive": false,
   "b2b_opt_in": false,
   "created_at": "2026-11-02T09:00:00+01:00",
   "special_status": [],
   "attestations": []
  },
  "screening": {
   "instrument": "PAR-Q+ 2023",
   "answers": {
    "parq_placeholder_01": false,
    "parq_placeholder_02": false,
    "parq_placeholder_03": false,
    "parq_placeholder_04": false,
    "parq_placeholder_05": false,
    "parq_placeholder_06": false,
    "parq_placeholder_07": false
   },
   "followup_answers": {},
   "item_factor": {
    "parq_placeholder_01": "known_disease",
    "parq_placeholder_02": "symptom",
    "parq_placeholder_03": "symptom",
    "parq_placeholder_04": "symptom",
    "parq_placeholder_05": "musculoskeletal",
    "parq_placeholder_06": "other",
    "parq_placeholder_07": "other"
   },
   "current_symptoms": {
    "C1": false,
    "C2": false,
    "C3": false,
    "C4": false,
    "B1": false,
    "B2": false,
    "B3": false,
    "B4": false,
    "H1": false,
    "H2": false,
    "E1": false,
    "I1": false,
    "I2": false,
    "I3": false
   },
   "guardian_attested_on": null,
   "guardian_hardcap_optin": false,
   "completed_on": "2026-11-02",
   "valid_until": "2027-11-02",
   "clearance_attested_on": null,
   "saf060_attested_on": null,
   "masters_checked": false
  },
  "claim": {
   "runs_per_week": 7,
   "weekly_distance_m": 120000,
   "weekly_time_s": 43200,
   "L30_distance_m": 35000,
   "L30_duration_s": 9900,
   "last_run_band": "this_week",
   "last_run_date": "2026-10-30",
   "continuous_30min": true
  },
  "anchors": [],
  "hr_references": [],
  "log": [
   {
    "id": "r001",
    "date": "2026-09-07",
    "entered_at": "2026-09-07T20:00:00+01:00",
    "type": "run",
    "source": "tick",
    "planned_session_id": null,
    "module_id": null,
    "duration_s": 5400,
    "distance_m": 20000,
    "rpe_0_10": 3,
    "pain_any": false,
    "pain_0_10": null,
    "pain_next_morning": null,
    "pain_settled_24h": null,
    "gi_score_0_10": null,
    "carb_g_per_h": null,
    "fuel_products": [],
    "fatigue_flag": false,
    "stopped_early_reason": null,
    "short_sleep_or_night_shift": false,
    "conditions_hot": false,
    "effort_all_out": null,
    "is_goal_race": false,
    "test_completed": null,
    "test_held_effort": null,
    "plausibility_answer": null,
    "notes": ""
   },
   {
    "id": "r002",
    "date": "2026-09-08",
    "entered_at": "2026-09-08T20:00:00+01:00",
    "type": "run",
    "source": "tick",
    "planned_session_id": null,
    "module_id": null,
    "duration_s": 5400,
    "distance_m": 20000,
    "rpe_0_10": 3,
    "pain_any": false,
    "pain_0_10": null,
    "pain_next_morning": null,
    "pain_settled_24h": null,
    "gi_score_0_10": null,
    "carb_g_per_h": null,
    "fuel_products": [],
    "fatigue_flag": false,
    "stopped_early_reason": null,
    "short_sleep_or_night_shift": false,
    "conditions_hot": false,
    "effort_all_out": null,
    "is_goal_race": false,
    "test_completed": null,
    "test_held_effort": null,
    "plausibility_answer": null,
    "notes": ""
   },
   {
    "id": "r003",
    "date": "2026-09-09",
    "entered_at": "2026-09-09T20:00:00+01:00",
    "type": "run",
    "source": "tick",
    "planned_session_id": null,
    "module_id": null,
    "duration_s": 5400,
    "distance_m": 20000,
    "rpe_0_10": 3,
    "pain_any": false,
    "pain_0_10": null,
    "pain_next_morning": null,
    "pain_settled_24h": null,
    "gi_score_0_10": null,
    "carb_g_per_h": null,
    "fuel_products": [],
    "fatigue_flag": false,
    "stopped_early_reason": null,
    "short_sleep_or_night_shift": false,
    "conditions_hot": false,
    "effort_all_out": null,
    "is_goal_race": false,
    "test_completed": null,
    "test_held_effort": null,
    "plausibility_answer": null,
    "notes": ""
   },
   {
    "id": "r004",
    "date": "2026-09-10",
    "entered_at": "2026-09-10T20:00:00+01:00",
    "type": "run",
    "source": "tick",
    "planned_session_id": null,
    "module_id": null,
    "duration_s": 5400,
    "distance_m": 20000,
    "rpe_0_10": 3,
    "pain_any": false,
    "pain_0_10": null,
    "pain_next_morning": null,
    "pain_settled_24h": null,
    "gi_score_0_10": null,
    "carb_g_per_h": null,
    "fuel_products": [],
    "fatigue_flag": false,
    "stopped_early_reason": null,
    "short_sleep_or_night_shift": false,
    "conditions_hot": false,
    "effort_all_out": null,
    "is_goal_race": false,
    "test_completed": null,
    "test_held_effort": null,
    "plausibility_answer": null,
    "notes": ""
   },
   {
    "id": "r005",
    "date": "2026-09-11",
    "entered_at": "2026-09-11T20:00:00+01:00",
    "type": "run",
    "source": "tick",
    "planned_session_id": null,
    "module_id": null,
    "duration_s": 5400,
    "distance_m": 20000,
    "rpe_0_10": 3,
    "pain_any": false,
    "pain_0_10": null,
    "pain_next_morning": null,
    "pain_settled_24h": null,
    "gi_score_0_10": null,
    "carb_g_per_h": null,
    "fuel_products": [],
    "fatigue_flag": false,
    "stopped_early_reason": null,
    "short_sleep_or_night_shift": false,
    "conditions_hot": false,
    "effort_all_out": null,
    "is_goal_race": false,
    "test_completed": null,
    "test_held_effort": null,
    "plausibility_answer": null,
    "notes": ""
   },
   {
    "id": "r006",
    "date": "2026-09-12",
    "entered_at": "2026-09-12T20:00:00+01:00",
    "type": "run",
    "source": "tick",
    "planned_session_id": null,
    "module_id": null,
    "duration_s": 5400,
    "distance_m": 20000,
    "rpe_0_10": 3,
    "pain_any": false,
    "pain_0_10": null,
    "pain_next_morning": null,
    "pain_settled_24h": null,
    "gi_score_0_10": null,
    "carb_g_per_h": null,
    "fuel_products": [],
    "fatigue_flag": false,
    "stopped_early_reason": null,
    "short_sleep_or_night_shift": false,
    "conditions_hot": false,
    "effort_all_out": null,
    "is_goal_race": false,
    "test_completed": null,
    "test_held_effort": null,
    "plausibility_answer": null,
    "notes": ""
   },
   {
    "id": "r007",
    "date": "2026-09-13",
    "entered_at": "2026-09-13T20:00:00+01:00",
    "type": "run",
    "source": "tick",
    "planned_session_id": null,
    "module_id": null,
    "duration_s": 9900,
    "distance_m": 36666,
    "rpe_0_10": 3,
    "pain_any": false,
    "pain_0_10": null,
    "pain_next_morning": false,
    "pain_settled_24h": null,
    "gi_score_0_10": null,
    "carb_g_per_h": null,
    "fuel_products": [],
    "fatigue_flag": false,
    "stopped_early_reason": null,
    "short_sleep_or_night_shift": false,
    "conditions_hot": false,
    "effort_all_out": null,
    "is_goal_race": false,
    "test_completed": null,
    "test_held_effort": null,
    "plausibility_answer": null,
    "notes": ""
   },
   {
    "id": "r008",
    "date": "2026-09-14",
    "entered_at": "2026-09-14T20:00:00+01:00",
    "type": "run",
    "source": "tick",
    "planned_session_id": null,
    "module_id": null,
    "duration_s": 5400,
    "distance_m": 20000,
    "rpe_0_10": 3,
    "pain_any": false,
    "pain_0_10": null,
    "pain_next_morning": null,
    "pain_settled_24h": null,
    "gi_score_0_10": null,
    "carb_g_per_h": null,
    "fuel_products": [],
    "fatigue_flag": false,
    "stopped_early_reason": null,
    "short_sleep_or_night_shift": false,
    "conditions_hot": false,
    "effort_all_out": null,
    "is_goal_race": false,
    "test_completed": null,
    "test_held_effort": null,
    "plausibility_answer": null,
    "notes": ""
   },
   {
    "id": "r009",
    "date": "2026-09-15",
    "entered_at": "2026-09-15T20:00:00+01:00",
    "type": "run",
    "source": "tick",
    "planned_session_id": null,
    "module_id": null,
    "duration_s": 5400,
    "distance_m": 20000,
    "rpe_0_10": 3,
    "pain_any": false,
    "pain_0_10": null,
    "pain_next_morning": null,
    "pain_settled_24h": null,
    "gi_score_0_10": null,
    "carb_g_per_h": null,
    "fuel_products": [],
    "fatigue_flag": false,
    "stopped_early_reason": null,
    "short_sleep_or_night_shift": false,
    "conditions_hot": false,
    "effort_all_out": null,
    "is_goal_race": false,
    "test_completed": null,
    "test_held_effort": null,
    "plausibility_answer": null,
    "notes": ""
   },
   {
    "id": "r010",
    "date": "2026-09-16",
    "entered_at": "2026-09-16T20:00:00+01:00",
    "type": "run",
    "source": "tick",
    "planned_session_id": null,
    "module_id": null,
    "duration_s": 5400,
    "distance_m": 20000,
    "rpe_0_10": 3,
    "pain_any": false,
    "pain_0_10": null,
    "pain_next_morning": null,
    "pain_settled_24h": null,
    "gi_score_0_10": null,
    "carb_g_per_h": null,
    "fuel_products": [],
    "fatigue_flag": false,
    "stopped_early_reason": null,
    "short_sleep_or_night_shift": false,
    "conditions_hot": false,
    "effort_all_out": null,
    "is_goal_race": false,
    "test_completed": null,
    "test_held_effort": null,
    "plausibility_answer": null,
    "notes": ""
   },
   {